{
  "$schema": "https://json-schema.org/draft/2020-12/schema",
  "$id": "https://mobile-ssh.github.io/schema/recipe.schema.json",
  "title": "Mobile SSH server recipe",
  "description": "Declarative server-side install/launch steps. The host shows the literal `run` commands in a consent dialog before executing any of them over SSH.",
  "type": "object",
  "required": ["steps"],
  "additionalProperties": false,
  "properties": {
    "description": { "type": "string" },
    "requires": {
      "description": "Optional preconditions the host probes before offering to run (e.g. docker present).",
      "type": "array",
      "items": { "type": "string" }
    },
    "steps": {
      "type": "array",
      "minItems": 1,
      "items": { "$ref": "#/$defs/step" }
    },
    "uninstall": {
      "description": "Optional cleanup steps run on the server when the user removes the plugin and chooses 'also remove from server'. Best-effort (non-zero exit is ignored); shown for consent like install steps.",
      "type": "array",
      "items": { "$ref": "#/$defs/step" }
    }
  },
  "$defs": {
    "step": {
      "type": "object",
      "required": ["id", "description", "run"],
      "additionalProperties": false,
      "properties": {
        "id": { "type": "string", "pattern": "^[A-Za-z0-9_-]+$" },
        "description": { "description": "Human-readable explanation shown beside the command in the consent dialog.", "type": "string" },
        "run": { "description": "The EXACT shell command to run on the remote (may contain {{vars}}). Shown verbatim to the user.", "type": "string" },
        "check": { "description": "Idempotency probe; if it exits 0 the step is already satisfied and is skipped.", "type": "string" },
        "sudo": { "description": "Whether the command needs root; the host surfaces this prominently.", "type": "boolean", "default": false },
        "stream": { "description": "Run via execStreaming so output (and captures) arrive live (e.g. install logs, auth URLs).", "type": "boolean", "default": false },
        "capture": {
          "description": "Map of variable name -> regex with one capture group, applied to stdout. Captured values are returned to the plugin and usable in serviceUrl as {{var}}.",
          "type": "object",
          "additionalProperties": { "type": "string" }
        },
        "forwardPort": { "description": "After this step, open the default tunnel to this remote port.", "type": "integer", "minimum": 1, "maximum": 65535 },
        "continueOnError": { "type": "boolean", "default": false },
        "timeoutMs": { "type": "integer", "minimum": 0 }
      }
    }
  }
}
